{
  "protocolo": "ECO-20260624-0002",
  "cliente": {
    "nome": "Residência Cláudio Ramos",
    "tipo_cliente": "residencia",
    "responsavel": "Cláudio Ramos",
    "whatsapp": "+5521988887777",
    "email": "c.ramos@yahoo.com.br",
    "endereco": "Estrada da Gávea, 1200",
    "bairro": "São Conrado",
    "cidade": "Rio de Janeiro"
  },
  "dados_eletricos": {
    "tipo_ligacao": "bifasico",
    "tensao": "127/220",
    "disjuntor_geral": "63",
    "padrao_entrada": "Muro padrão Light",
    "aterramento": true,
    "dr_dps": true,
    "quadro_cargas_criticas": true,
    "distancia_inversor_quadro_metros": 5,
    "distancia_baterias_quadro_metros": 5
  },
  "dados_conta": {
    "consumo_mensal_kwh": 850,
    "valor_medio_conta": 980.00,
    "concessionaria": "Light",
    "tarifa": 1.15,
    "demanda_contratada_kw": 0,
    "objetivo": "economia",
    "historico_12_meses_kwh": [800, 850, 900, 870, 780, 810, 830, 890, 920, 840, 820, 860]
  },
  "dados_solares": {
    "area_disponivel_m2": 60,
    "tipo_telhado_laje": "telha cerâmica colonial",
    "sombreamento": "parcial no final de tarde",
    "orientacao": "norte-noroeste",
    "inclinacao": "20 graus",
    "local_inversor": "garagem coberta",
    "local_baterias": "garagem coberta junto ao inversor",
    "ventilacao_adequada": true
  },
  "cargas_criticas": [
    {
      "nome_carga": "Iluminação Básica da Casa",
      "potencia_w": 200,
      "quantidade": 1,
      "horas_uso_diario": 6,
      "simultanea": true,
      "motor": false,
      "prioridade": 1
    },
    {
      "nome_carga": "Geladeira Inverter",
      "potencia_w": 150,
      "quantidade": 1,
      "horas_uso_diario": 24,
      "simultanea": true,
      "motor": true,
      "pico_partida": {
        "tipo_partida": "inversor_frequencia",
        "corrente_partida_a": 2,
        "fator_pico": 1.2
      },
      "prioridade": 1
    },
    {
      "nome_carga": "Roteador Internet e CFTV Interno",
      "potencia_w": 120,
      "quantidade": 1,
      "horas_uso_diario": 24,
      "simultanea": true,
      "motor": false,
      "prioridade": 1
    },
    {
      "nome_carga": "TV e Home Office",
      "potencia_w": 350,
      "quantidade": 1,
      "horas_uso_diario": 6,
      "simultanea": true,
      "motor": false,
      "prioridade": 2
    },
    {
      "nome_carga": "Motor de Portão Automático PPA",
      "potencia_w": 370,
      "quantidade": 1,
      "horas_uso_diario": 0.5,
      "simultanea": false,
      "motor": true,
      "pico_partida": {
        "tipo_partida": "direta",
        "corrente_partida_a": 8,
        "fator_pico": 4.0
      },
      "prioridade": 2
    }
  ],
  "autonomia_desejada_horas": 12,
  "status": "calculado_preliminar",
  "compliance_killcritic": {
    "status_killcritic": "APROVADO",
    "risco_killcritic": "baixo",
    "motivos_bloqueio": [],
    "pendencias_criticas": [
      "Realizar Avaliação Técnica presencial obrigatória para confirmar local físico das baterias"
    ]
  }
}
